{
  "id": "irrational-behaviour",
  "name": "Irrational Behaviour",
  "description": "Irrational Behaviour is a script that explores themes of illogical actions and unpredictable behavior. Characters have abilities that defy conventional logic and reasoning.",
  "author": "Josh",
  "version": "1.0.0",
  "characters": [
    "investigator",
    "librarian",
    "chef",
    "empath",
    "fortune-teller",
    "ravenkeeper",
    "oracle",
    "savant",
    "seamstress",
    "philosopher",
    "artist",
    "juggler",
    "sage",
    "town-crier",
    "mathematician",
    "flowergirl",
    "dreamer",
    "clockmaker",
    "snake-charmer",
    "barber",
    "sweetheart",
    "klutz",
    "mutant",
    "damsel",
    "golem",
    "hatter",
    "heretic",
    "hermit",
    "ogre",
    "plague-doctor",
    "politician",
    "puzzlemaster",
    "snitch",
    "zealot",
    "spy",
    "poisoner",
    "scarlet-woman",
    "baron",
    "witch",
    "cerenovus",
    "pit-hag",
    "evil-twin",
    "godfather",
    "devils-advocate",
    "assassin",
    "mastermind",
    "fang-gu",
    "vigormortis",
    "no-dashii",
    "vortox",
    "al-hadikhia",
    "kazali",
    "legion",
    "leviathan",
    "lil-monsta",
    "lleech",
    "lord-of-typhon",
    "ojo",
    "riot",
    "yaggababble"
  ],
  "playerCount": {
    "min": 5,
    "max": 15,
    "optimal": "8-12"
  },
  "complexity": "intermediate",
  "tags": [
    "carousel",
    "irrational",
    "unpredictable",
    "featured"
  ],
  "estimatedTime": "75-90 minutes",
  "characterDistribution": {
    "townsfolk": 20,
    "outsiders": 11,
    "minions": 16,
    "demons": 11
  },
  "composition": {
    "5": { "townsfolk": 3, "outsiders": 1, "minions": 1, "demons": 1 },
    "6": { "townsfolk": 3, "outsiders": 1, "minions": 1, "demons": 1 },
    "7-9": { "townsfolk": "p-3", "outsiders": 0, "minions": 2, "demons": 1 },
    "10-12": { "townsfolk": "p-4", "outsiders": 1, "minions": 2, "demons": 1 },
    "13-15": { "townsfolk": "p-5", "outsiders": 2, "minions": 2, "demons": 1 }
  },
  "specialRules": [
    "Focus on illogical and unpredictable behavior",
    "Characters that defy conventional reasoning",
    "Explores concepts of irrationality and chaos"
  ],
  "setupNotes": "This script embraces irrationality and unpredictability. Players should expect abilities that challenge logical thinking and conventional gameplay.",
  "winConditions": {
    "good": "Execute all evil characters",
    "evil": "Survive to equal the number of good players"
  },
  "wikiUrl": null,
  "howToRun": "Chaotic actions with logical resolution. State edge-case rulings upfront. Keep night order strict so “irrational” stays fair.",
  "firstNight": [
    {"id":"minion-info","type":"meta","action":"showTeamToMinions","description":"Wake all Minions together. Show them who the other Minions are and who the Demon is","targets":["minions"],"information":{"showPlayersByTeam":["minions","demons"],"showRoles":false},"order":1},
    {"id":"demon-info","type":"meta","action":"showTeamAndBluffsToDemon","description":"Wake the Demon. Show them who their Minions are. Give them 3 character tokens as bluffs","targets":["demons"],"information":{"showPlayersByTeam":["minions"],"showRoles":false,"giveBluffs":3},"order":2}
  ],
  "tipsAndTricks": "Good: Separate noise from signal by aggregating over days. Evil: Add just-enough noise to make real contradictions look random.",
  "bluffing": "Blame oddities on the script; keep your story stable.",
  "legacy": null
}