{
  "id": "contempt",
  "name": "Contempt",
  "description": "Contempt is a script that explores themes of social dynamics and interpersonal relationships. Characters in this script often have abilities that affect how players interact with each other and the social fabric of the game.",
  "author": "Milk",
  "version": "1.0.0",
  "characters": [
    "washerwoman",
    "librarian",
    "investigator",
    "chef",
    "empath",
    "fortune-teller",
    "undertaker",
    "monk",
    "ravenkeeper",
    "virgin",
    "slayer",
    "soldier",
    "mayor",
    "butler",
    "drunk",
    "recluse",
    "saint",
    "poisoner",
    "spy",
    "scarlet-woman",
    "baron",
    "imp",
    "grandmother",
    "sailor",
    "chambermaid",
    "exorcist",
    "innkeeper",
    "gambler",
    "gossip",
    "courtier",
    "professor",
    "minstrel",
    "tea-lady",
    "pacifist",
    "fool",
    "goon",
    "lunatic",
    "tinker",
    "moonchild",
    "godfather",
    "devils-advocate",
    "assassin",
    "mastermind",
    "zombuul",
    "pukka",
    "shabaloth",
    "po",
    "clockmaker",
    "dreamer",
    "snake-charmer",
    "mathematician",
    "flowergirl",
    "town-crier",
    "oracle",
    "savant",
    "seamstress",
    "philosopher",
    "artist",
    "juggler",
    "sage",
    "mutant",
    "sweetheart",
    "klutz",
    "evil-twin",
    "witch",
    "cerenovus",
    "pit-hag",
    "fang-gu",
    "vigormortis",
    "no-dashii",
    "vortox"
  ],
  "playerCount": {
    "min": 5,
    "max": 15,
    "optimal": "8-12"
  },
  "complexity": "intermediate",
  "tags": [
    "carousel",
    "social-dynamics",
    "interpersonal",
    "featured"
  ],
  "estimatedTime": "75-90 minutes",
  "characterDistribution": {
    "townsfolk": 13,
    "outsiders": 4,
    "minions": 4,
    "demons": 4
  },
  "composition": {
    "5": {
      "townsfolk": 3,
      "outsiders": 1,
      "minions": 1,
      "demons": 1
    },
    "6": {
      "townsfolk": 3,
      "outsiders": 1,
      "minions": 1,
      "demons": 1
    },
    "7-9": {
      "townsfolk": "p-3",
      "outsiders": 0,
      "minions": 2,
      "demons": 1
    },
    "10-12": {
      "townsfolk": "p-4",
      "outsiders": 1,
      "minions": 2,
      "demons": 1
    },
    "13-15": {
      "townsfolk": "p-5",
      "outsiders": 2,
      "minions": 2,
      "demons": 1
    }
  },
  "specialRules": [
    "Focus on social interactions and relationships",
    "Characters that affect player dynamics",
    "Mix of classic and experimental characters"
  ],
  "setupNotes": "This script emphasizes social gameplay and interpersonal relationships. Players should focus on building and manipulating social connections.",
  "winConditions": {
    "good": "Execute all evil characters",
    "evil": "Survive to equal the number of good players"
  },
  "wikiUrl": null,
  "howToRun": "High-pressure, accusation-heavy table. Enforce clear nomination phrasing and voting cadence. Keep executions crisp to avoid social stalemates.",
  "firstNight": [
    {
      "id": "minion-info",
      "type": "meta",
      "action": "showTeamToMinions",
      "description": "Wake all Minions together. Show them who the other Minions are and who the Demon is",
      "targets": [
        "minions"
      ],
      "information": {
        "showPlayersByTeam": [
          "minions",
          "demons"
        ],
        "showRoles": false
      },
      "order": 1
    },
    {
      "id": "demon-info",
      "type": "meta",
      "action": "showTeamAndBluffsToDemon",
      "description": "Wake the Demon. Show them who their Minions are. Give them 3 character tokens as bluffs",
      "targets": [
        "demons"
      ],
      "information": {
        "showPlayersByTeam": [
          "minions"
        ],
        "showRoles": false,
        "giveBluffs": 3
      },
      "order": 2
    }
  ],
  "tipsAndTricks": "Good: Demand receipts; align behind verifiable plans. Evil: Stoke rivalries, split votes, force time pressure.",
  "bluffing": "Adopt assertive personas; justify votes with simple heuristics that sound principled.",
  "legacy": null,
  "modifiers": [
    {
      "type": "mutuallyExclusive",
      "characters": [
        "soldier",
        "saint"
      ],
      "note": "Soldier and Saint provide overlapping survival abilities."
    },
    {
      "type": "mutuallyExclusive",
      "characters": [
        "mayor",
        "saint"
      ],
      "note": "Mayor and Saint both provide execution protection."
    },
    {
      "type": "requires",
      "whenCharacter": "drunk",
      "requireCharacters": [
        "chef",
        "empath",
        "fortune-teller",
        "investigator",
        "librarian",
        "washerwoman"
      ],
      "note": "Drunk needs Townsfolk with abilities to malfunction."
    },
    {
      "type": "requires",
      "whenCharacter": "recluse",
      "requireCharacters": [
        "undertaker",
        "empath",
        "fortune-teller"
      ],
      "note": "Recluse benefits from characters that can detect or confirm alignment changes."
    },
    {
      "type": "adjustCounts",
      "whenCharacter": "baron",
      "delta": {
        "outsiders": 2,
        "townsfolk": -2
      },
      "note": "Baron adds 2 Outsiders and removes 2 Townsfolk."
    },
    {
      "type": "adjustCounts",
      "whenCharacter": "godfather",
      "delta": {
        "outsiders": 1,
        "townsfolk": -1
      },
      "note": "Godfather adds 1 Outsider and removes 1 Townsfolk."
    }
  ]
}