{
  "id": "monkey-do-math",
  "name": "Monkey Do Math",
  "description": "Monkey Do Math is a script that explores themes of calculation, probability, and mathematical reasoning. Characters have abilities related to numbers, patterns, and logical computation.",
  "author": "Jams, Josh, Kerry, & Zak",
  "version": "1.0.0",
  "characters": [
    "mathematician",
    "investigator",
    "librarian",
    "chef",
    "empath",
    "fortune-teller",
    "ravenkeeper",
    "oracle",
    "savant",
    "seamstress",
    "philosopher",
    "artist",
    "juggler",
    "sage",
    "town-crier",
    "flowergirl",
    "dreamer",
    "clockmaker",
    "snake-charmer",
    "barber",
    "sweetheart",
    "klutz",
    "mutant",
    "damsel",
    "golem",
    "hatter",
    "heretic",
    "hermit",
    "ogre",
    "plague-doctor",
    "politician",
    "puzzlemaster",
    "snitch",
    "zealot",
    "spy",
    "poisoner",
    "scarlet-woman",
    "baron",
    "witch",
    "cerenovus",
    "pit-hag",
    "evil-twin",
    "godfather",
    "devils-advocate",
    "assassin",
    "mastermind",
    "fang-gu",
    "vigormortis",
    "no-dashii",
    "vortox",
    "al-hadikhia",
    "kazali",
    "legion",
    "leviathan",
    "lil-monsta",
    "lleech",
    "lord-of-typhon",
    "ojo",
    "riot",
    "yaggababble"
  ],
  "playerCount": {
    "min": 5,
    "max": 15,
    "optimal": "8-12"
  },
  "complexity": "intermediate",
  "tags": [
    "carousel",
    "mathematics",
    "logic",
    "calculation",
    "featured"
  ],
  "estimatedTime": "75-90 minutes",
  "characterDistribution": {
    "townsfolk": 20,
    "outsiders": 11,
    "minions": 16,
    "demons": 11
  },
  "composition": {
    "5": {
      "townsfolk": 3,
      "outsiders": 1,
      "minions": 1,
      "demons": 1
    },
    "6": {
      "townsfolk": 3,
      "outsiders": 1,
      "minions": 1,
      "demons": 1
    },
    "7-9": {
      "townsfolk": "p-3",
      "outsiders": 0,
      "minions": 2,
      "demons": 1
    },
    "10-12": {
      "townsfolk": "p-4",
      "outsiders": 1,
      "minions": 2,
      "demons": 1
    },
    "13-15": {
      "townsfolk": "p-5",
      "outsiders": 2,
      "minions": 2,
      "demons": 1
    }
  },
  "specialRules": [
    "Focus on mathematical and logical abilities",
    "Characters with calculation and probability mechanics",
    "Explores concepts of patterns and reasoning"
  ],
  "setupNotes": "This script emphasizes mathematical thinking and logical reasoning. Players should be prepared for abilities involving numbers, patterns, and probability.",
  "winConditions": {
    "good": "Execute all evil characters",
    "evil": "Survive to equal the number of good players"
  },
  "wikiUrl": null,
  "howToRun": "Combines chaos and numeric reads. Present results in tidy formats and highlight when randomness applies.",
  "firstNight": [
    {
      "id": "minion-info",
      "type": "meta",
      "action": "showTeamToMinions",
      "description": "Wake all Minions together. Show them who the other Minions are and who the Demon is",
      "targets": [
        "minions"
      ],
      "information": {
        "showPlayersByTeam": [
          "minions",
          "demons"
        ],
        "showRoles": false
      },
      "order": 1
    },
    {
      "id": "demon-info",
      "type": "meta",
      "action": "showTeamAndBluffsToDemon",
      "description": "Wake the Demon. Show them who their Minions are. Give them 3 character tokens as bluffs",
      "targets": [
        "demons"
      ],
      "information": {
        "showPlayersByTeam": [
          "minions"
        ],
        "showRoles": false,
        "giveBluffs": 3
      },
      "order": 2
    }
  ],
  "tipsAndTricks": "Good: Build rolling tallies; compare deltas. Evil: Shift poison targets to disrupt trending numbers.",
  "bluffing": "Quote small, precise numbers and keep them consistent.",
  "legacy": null,
  "modifiers": [
    {
      "type": "adjustCounts",
      "whenCharacter": "baron",
      "delta": {
        "outsiders": 2,
        "townsfolk": -2
      },
      "note": "Baron adds 2 Outsiders and removes 2 Townsfolk."
    },
    {
      "type": "adjustCounts",
      "whenCharacter": "godfather",
      "delta": {
        "outsiders": 1,
        "townsfolk": -1
      },
      "note": "Godfather adds 1 Outsider and removes 1 Townsfolk."
    }
  ]
}