{
  "id": "the-midnight-oasis",
  "name": "The Midnight Oasis",
  "description": "The Midnight Oasis is a script about doing. While there are some information roles, the script is defined by power characters that have significant, exciting effects on the game - Farmer, Golem, Engineer, Professor, Poppy Grower, Pit-Hag & Psychopath among them.",
  "author": "Lachlan",
  "version": "1.0.0",
  "characters": [
    "farmer",
    "golem",
    "engineer",
    "professor",
    "poppy-grower",
    "pit-hag",
    "psychopath",
    "al-hadikhia",
    "balloonist",
    "cannibal",
    "general",
    "high-priestess",
    "huntsman",
    "lycanthrope",
    "magician",
    "nightwatchman",
    "noble",
    "pixie",
    "preacher",
    "princess",
    "shugenja",
    "steward",
    "village-idiot",
    "damsel",
    "hatter",
    "heretic",
    "hermit",
    "ogre",
    "plague-doctor",
    "politician",
    "puzzlemaster",
    "snitch",
    "zealot",
    "boffin",
    "boomdandy",
    "fearmonger",
    "goblin",
    "harpy",
    "marionette",
    "mezepheles",
    "organ-grinder",
    "summoner",
    "vizier",
    "widow",
    "wizard",
    "wraith",
    "xaan",
    "kazali",
    "legion",
    "leviathan",
    "lil-monsta",
    "lleech",
    "lord-of-typhon",
    "ojo",
    "riot",
    "yaggababble"
  ],
  "playerCount": {
    "min": 5,
    "max": 20,
    "optimal": "10-15"
  },
  "complexity": "advanced",
  "tags": [
    "carousel",
    "experimental",
    "power-characters",
    "featured"
  ],
  "estimatedTime": "90-120 minutes",
  "characterDistribution": {
    "townsfolk": 22,
    "outsiders": 11,
    "minions": 16,
    "demons": 11
  },
  "composition": {
    "5": {
      "townsfolk": 3,
      "outsiders": 1,
      "minions": 1,
      "demons": 1
    },
    "6": {
      "townsfolk": 3,
      "outsiders": 1,
      "minions": 1,
      "demons": 1
    },
    "7-9": {
      "townsfolk": "p-3",
      "outsiders": 0,
      "minions": 2,
      "demons": 1
    },
    "10-12": {
      "townsfolk": "p-4",
      "outsiders": 1,
      "minions": 2,
      "demons": 1
    },
    "13-15": {
      "townsfolk": "p-5",
      "outsiders": 2,
      "minions": 2,
      "demons": 1
    }
  },
  "specialRules": [
    "Focus on powerful character abilities",
    "Experimental characters from The Carousel",
    "High complexity with many moving parts"
  ],
  "setupNotes": "This script features many powerful characters that can significantly impact the game. Storytellers should be familiar with all character abilities before running.",
  "winConditions": {
    "good": "Execute all evil characters",
    "evil": "Survive to equal the number of good players"
  },
  "wikiUrl": null,
  "howToRun": "Pockets of safety amid danger. Clearly mark “oasis” zones (when, who, how long).",
  "firstNight": [
    {
      "id": "minion-info",
      "type": "meta",
      "action": "showTeamToMinions",
      "description": "Wake all Minions together. Show them who the other Minions are and who the Demon is",
      "targets": [
        "minions"
      ],
      "information": {
        "showPlayersByTeam": [
          "minions",
          "demons"
        ],
        "showRoles": false
      },
      "order": 1
    },
    {
      "id": "demon-info",
      "type": "meta",
      "action": "showTeamAndBluffsToDemon",
      "description": "Wake the Demon. Show them who their Minions are. Give them 3 character tokens as bluffs",
      "targets": [
        "demons"
      ],
      "information": {
        "showPlayersByTeam": [
          "minions"
        ],
        "showRoles": false,
        "giveBluffs": 3
      },
      "order": 2
    }
  ],
  "tipsAndTricks": "Good: Time actions to coincide with oasis windows. Evil: Attack just outside safety to maximize fear.",
  "bluffing": "Claim you can extend or relocate safety to steer votes.",
  "legacy": null,
  "modifiers": [
    {
      "type": "adjustCounts",
      "whenCharacter": "balloonist",
      "delta": {
        "outsiders": 1,
        "townsfolk": -1
      },
      "note": "Balloonist adds 1 Outsider and removes 1 Townsfolk."
    }
  ]
}